<?xml version="1.0" encoding="euc-kr" standalone="no"?>
<!DOCTYPE superEntry SYSTEM "2007nn.dtd">
<superEntry>
	<orth>차손</orth>
	<entry n="1" pos="nng_s">
		<mnt_grp>
			<cre>
				<cre_date>2003/08/08</cre_date>
				<cre_writer>이민우</cre_writer>
			</cre>
			<mod>
				<mod_date>2003/10/10</mod_date>
				<mod_writer>이민우</mod_writer>
			</mod>
			<mod>
				<mod_date>2004/09/07</mod_date>
				<mod_writer>송근영</mod_writer>
				<mod_note>관련어 항목 추가</mod_note>
				<mod_note>동사결합 정보 수정 및 추가</mod_note>
			</mod>
			<mod>
				<mod_date>2004/11/19</mod_date>
				<mod_writer>박만규</mod_writer>
				<mod_note></mod_note>
			</mod>
			<mod>
		    	<mod_date>2004/12/30</mod_date>
				<mod_writer>장원철</mod_writer>
		        <mod_note></mod_note>
	        </mod>
		</mnt_grp>
		<morph_grp>
			<org lg="si">次孫</org>
		
		</morph_grp>
		<idm_grp>
		</idm_grp>
		<sense n="1">
			<sem_grp>
				<eg>우리 집안에 얼마전 ~이 태어났다.</eg>
				<trans>the younger grandson</trans>
				<sem_class>비대칭적친족</sem_class>
				<lr>
					<rel>장손</rel>
				</lr>
			</sem_grp>
			<syn_grp>
				<comb_v type="narg_vpred">
					<form vcompound="no">~이 태어나다</form> <!--송근영 추가-->
					<frame></frame>
				</comb_v>
				<comb_v type="narg_vpred">
					<form vcompound="no">~을 보다</form> <!--송근영 추가-->
					<frame></frame>
				</comb_v>
				<comb_v type="npred_vsup">
					<form vcompound="yes">~이 되다</form> <!-- '~'를 '~이 되다'로 수정(송근영) -->
					<frame>X-이 Y-에게 ~이 되다</frame>
				</comb_v>
				<sel_rst arg="X">인간</sel_rst>
				<sel_rst arg="Y">인간</sel_rst>
			</syn_grp>
		</sense>
	</entry>
</superEntry>