<?xml version="1.0" encoding="euc-kr" standalone="no"?>
<!DOCTYPE superEntry SYSTEM "2007nn.dtd">

<superEntry>
	<orth>멸종</orth>
	<entry n="1" pos="nng_s">
		<mnt_grp>
			<cre>
				<cre_date>2002/06/11</cre_date>
				<cre_writer>이병규</cre_writer>
				<cre_note></cre_note>
			</cre>
			<mod>
				<mod_date>2003/08/13</mod_date>
				<mod_writer>김미현</mod_writer>
				<mod_note></mod_note>
			</mod>
			<mod>
				<mod_date>2005/09/01</mod_date>
				<mod_writer>김천학</mod_writer>
				<mod_note>수정없음</mod_note>
			</mod>
			<note>2002/06/11(남길임)</note>
			<note>2002/06/22(이성헌)</note>
			<note>2003/05/23(김미현)의미부류를 '순간적행위'에서 '결과행위'로 수정.멸종이 항상 부정적인 결과만은 아니므로, '부정적결과행위'보다 '결과행위'로 놔두는 것이 타당한 듯 보임.</note>
			<note>단위표현에 '차례' 추가 </note>
			<note>cor_v에 '~하다|되다' 기술</note>
			<note>명사 연어에 '~의 위기' 추가</note>
			<note>2003/08/12(고길수)예문 수정, 연세사전 예문이 그대로 들어있었음</note>
			<note>없어지는 것에서 단위표현이 가능한지 궁금... 삭제함</note>
			<note>기능동사 입력법 수정</note>
			<note>2003/08/13(김미현)</note>
			<add></add>
		</mnt_grp>
		<see></see>
		<morph_grp>
			<var type="temp"></var>
			<str type="temp"></str>
			<org lg="si">滅種</org>
		
			<hom exist="temp"></hom>
			<der pos="temp" type="temp"></der>
			<comp pos="temp" type="temp"></comp>
			<metc pos="temp" type="temp"></metc>
			<img type="temp"></img>
		</morph_grp>
		<idm_grp>
			<idm type="temp"></idm>
		</idm_grp>
		<sense n="1">
			<sem_grp>
				<eg>우리나라의 호랑이는 ~의 위기에 놓여 있다.</eg>
				<trans>extermination of a race</trans>
				<trans>extermination of a stock</trans>
				<domain></domain>
				<reg></reg>
				<con></con>
				<sem_class>소멸</sem_class>
				<lr>
					<syn type="temp"></syn>
					<ant type="temp"></ant>
					<rel></rel>
				</lr>
			</sem_grp>
			<syn_grp>
				<comb_aj type="temp"></comb_aj>
				<comb_n type="compound">~의 위기</comb_n>
				<comb_v type="npred_vsup">
					<form vcompound="yes">~을 하다</form>
					<frame>X-이 ~을 하다</frame>
				</comb_v>
				<comb_v type="npred_vsup">
					<form vcompound="yes">~이 되다</form>
					<frame>X-이 ~이 되다</frame>
				</comb_v>
				<!--vcompound: ~하다-->
				<!--vcompound: ~되다-->
				<max_n_str></max_n_str>
				<sel_rst arg="X">생물</sel_rst>
				<cl type="temp"></cl>
				<prt></prt>
				<av></av>
				<pre_d/>
				<pre_n/>
				<s_n/>
			</syn_grp>
		</sense>
	</entry>
</superEntry>