<?xml version="1.0" encoding="euc-kr" standalone="no"?>
<!DOCTYPE superEntry SYSTEM "2007nn.dtd">
<superEntry>
	<orth>국제기구</orth>
	<entry pos="nng_c">
		<mnt_grp>
			<cre>
				<cre_date>2004/07/30</cre_date>
				<cre_writer>김진형</cre_writer>
				<cre_note></cre_note>
			</cre>
			<mod>
				<mod_date>2004/0/</mod_date>
				<mod_writer>박진호</mod_writer>
				<mod_note></mod_note>
			</mod>
			<mod>
				<mod_date>2007/08/09</mod_date>
				<mod_writer>이홍식</mod_writer>
				<mod_note></mod_note>
			</mod>
			<add></add>
		</mnt_grp>
		<see></see>
		<morph_grp>
			<var type="spr">국제 기구</var>
			<str type="R_N">국제+기구</str>
			<org lg="si">國際機構</org>
		</morph_grp>
		<idm_grp>
			<idm type="etc"></idm>
		</idm_grp>
		<sense>
			<sem_grp>
				<eg>우리나라는 여러 ~의 회의를 차례로 개최한다고 한다.</eg>
				<trans>international organization</trans>
				<domain></domain>
				<sem_class>국제기구</sem_class>
				<lr>
					<syn type="etc"></syn>
					<ant type="etc"></ant>
				</lr>
			</sem_grp>
			<syn_grp>
				<comb_aj type="appr"></comb_aj>
				<comb_n type="lexfunc"></comb_n>
				<comb_v type="narg_vpred">
					<form vcompound="no">~를 설립하다</form>
					<frame></frame>
				</comb_v>
				<comb_v type="narg_vpred">
					<form vcompound="no">~에 가입하다</form>
					<frame></frame>
				</comb_v>
				<comb_v type="narg_vpred">
					<form vcompound="no">~에서 탈퇴하다</form>
					<frame></frame>
				</comb_v>
				<max_n_str></max_n_str>
				<sel_rst arg="X"></sel_rst>
				<cl type="uni">개</cl>
			</syn_grp>
		</sense>
	</entry>
</superEntry>