<?xml version="1.0" encoding="euc-kr" standalone="no"?>
<!DOCTYPE superEntry SYSTEM "2007nn.dtd">

<superEntry>
	<orth>세계</orth>
	<entry n="1" pos="nng_s">
		<mnt_grp>
			<cre>
				<cre_date>2000/10/05</cre_date>
				<cre_writer>김종명</cre_writer>
				<cre_note></cre_note>
			</cre>
			<mod>
				<mod_date>2003/03/31</mod_date>
				<mod_writer>이민우</mod_writer>
				<mod_note></mod_note>
			</mod>
			<mod>
				<mod_date>2006/09/18</mod_date>
				<mod_writer>이민우</mod_writer>
				<mod_note></mod_note>
			</mod>
			<mod>
				<mod_date>2007/08/15</mod_date>
				<mod_writer>고길수</mod_writer>
				<mod_note>센스1 장소를 지역과 인간집단으로 분할;센스3을 속성에서 분야로 수정;맥스엔, 선택제약 정보 추가;수식어 명사에서 N(-의) 삭제;센스4를 추상적대상에서 관계추상적대상으로 수정;맥스엔, 선택제약 정보 추가;수식어 명사에서 N(-의) 삭제</mod_note>
			</mod>
			<note>2003/01/11(이민우)</note>
			<note>2003/03/28(김종명)</note>
			<note>2003/03/31(이민우)</note>
			<add>~가 좁아지다</add>
		</mnt_grp>
		<see></see>
		<morph_grp>
			<var type="temp"></var>
			<str type="temp"></str>
			<org lg="si">世界</org>
			<hom exist="temp"></hom>
			<der pos="n" type="suffix">~관</der>
			<der pos="n" type="suffix">~적</der>
			<der pos="n" type="suffix">~화</der>
			<der pos="n" type="suffix">~상</der>
			<der pos="n" type="suffix">~사</der>
			<der pos="n" type="suffix">~어</der>
			<der pos="n" type="suffix">~인</der>
			<der pos="n" type="prefix">신~</der>
			<comp pos="n" type="suffix">~주의</comp>
			<metc pos="temp" type="temp"></metc>
			<img type="temp"></img>
		</morph_grp>
		<idm_grp>
			<idm type="temp"></idm>
		</idm_grp>
		<sense n="1">
			<sem_grp>
				<eg>그는 ~ 여러 곳을 여행을 다녔다.</eg>
				<trans>world</trans>
				<domain></domain>
				<reg></reg>
				<con></con>
				<curs type="U"/>
				<sem_class>지역</sem_class>
				<lr>
					<syn type="temp"></syn>
					<ant type="temp"></ant>
					<rel></rel>
				</lr>
			</sem_grp>
			<syn_grp>
				<comb_aj type="appr">~가 넓다</comb_aj>
				<comb_n type="temp"></comb_n>
				<comb_v type="temp">
					<form vcompound="temp"></form>
					<frame></frame>
				</comb_v>
				<max_n_str></max_n_str>
				<sel_rst arg="temp"></sel_rst>
				<cl type="temp"></cl>
				<prt></prt>
				<av></av>
				<pre_d/>
				<pre_n/>
				<s_n/>
			</syn_grp>
		</sense>
		<sense n="2">
			<sem_grp>
				<eg>~가 점점 하나의 시장이 되고 있다.</eg>
				<eg>우리나라의 눈부신 성장에 ~가 깜짝 놀랐다.</eg>
				<trans>world</trans>
				<domain></domain>
				<reg></reg>
				<con></con>
				<curs type="U"/>
				<sem_class>인간집단</sem_class>
				<lr>
					<syn type="temp"></syn>
					<ant type="temp"></ant>
					<rel></rel>
				</lr>
			</sem_grp>
			<syn_grp>
				<comb_aj type="appr"></comb_aj>
				<comb_n type="temp"></comb_n>
				<comb_v type="temp">
					<form vcompound="temp"></form>
					<frame></frame>
				</comb_v>
				<max_n_str></max_n_str>
				<sel_rst arg="temp"></sel_rst>
				<cl type="temp"></cl>
				<prt></prt>
				<av></av>
				<pre_d/>
				<pre_n/>
				<s_n/>
			</syn_grp>
		</sense>
		<sense n="3">
			<sem_grp>
				<eg>남자들의 ~란 그런 것이다.</eg>
				<trans>society</trans>
				<domain></domain>
				<reg></reg>
				<con></con>
				<curs type="C"/>
				<sem_class>분야</sem_class>
				<lr>
					<syn type="temp"></syn>
					<ant type="temp"></ant>
					<rel></rel>
				</lr>
			</sem_grp>
			<syn_grp>
				<comb_aj type="appr">~가 다르다</comb_aj>
				<comb_n type="temp"></comb_n>
				<comb_v type="narg_vpred">
					<form vcompound="no">~를 알다</form>
					<frame></frame>
				</comb_v>
				<comb_v type="narg_vpred">
					<form vcompound="no">~를 바꾸다</form>
					<frame></frame>
				</comb_v>
				
				<max_n_str>X-의 ~</max_n_str>
				<max_n_str>X ~</max_n_str>
				<sel_rst arg="X">인간|인간집단|동물</sel_rst>
				<cl type="temp"></cl>
				<prt></prt>
				<av></av>
				<pre_d/>
				<pre_n></pre_n>
				<s_n/>
			</syn_grp>
		</sense>
		<sense n="4">
			<sem_grp>
				<eg>우리는 지금 또 다른 차원의 정신 ~를 탐구하고 있다.</eg>
				<trans>world</trans>
				<domain></domain>
				<reg></reg>
				<con></con>
				<curs type="C"/>
				<sem_class>관계추상적대상</sem_class>
				<lr>
					<syn type="temp"></syn>
					<ant type="temp"></ant>
					<rel></rel>
				</lr>
			</sem_grp>
			<syn_grp>
				<comb_aj type="temp"></comb_aj>
				<comb_n type="temp"></comb_n>
				<comb_v type="temp">
					<form vcompound="temp"></form>
					<frame></frame>
				</comb_v>
				<max_n_str>X-의 ~</max_n_str>
				<max_n_str>X ~</max_n_str>
				<sel_rst arg="X">무생물|추상적대상</sel_rst>
				<cl type="temp"></cl>
				<prt></prt>
				<av></av>
				<pre_d/>
				<pre_n></pre_n>
				<s_n/>
			</syn_grp>
		</sense>
	</entry>
</superEntry>