<?xml version="1.0" encoding="euc-kr" standalone="no"?>
<!DOCTYPE superEntry SYSTEM "2007nn.dtd">




<superEntry>
	<orth>포즈</orth>
	<entry n="1" pos="nng_s">
		<mnt_grp>
			<cre>
				<cre_date>2002/08/23</cre_date>
				<cre_writer>김미현</cre_writer>
				<cre_note></cre_note>
			</cre>
			<mod>
				<mod_date>2003/06/18</mod_date>
				<mod_writer>이성헌</mod_writer>
				<mod_note></mod_note>
			</mod>
			<mod>
				<mod_date>2005/08/31</mod_date>
				<mod_writer>전미현</mod_writer>
				<mod_note></mod_note>
			</mod>
                        <mod>
                                <mod_date>2005/10/06</mod_date>
                                <mod_writer>박만규</mod_writer>
                                <mod_note></mod_note>
                        </mod>
                        <mod>
				<mod_date>2007/10/03</mod_date>
				<mod_writer>하신영</mod_writer>
				<mod_note></mod_note>
			</mod>
			<note>2002/08/23(김미현)늘임표, 쉼표의 뜻으로 쓰인 포즈의 sem은 무엇입니까? 의미부류에 구두점(.,!?)이 어디에 속하는지 모르겠습니다.</note>
			<note>2002/09/09(박동호)일단 '추상적대상'의 하위부류인 '기호'로 하는 것이 좋겠음.2002/10/11(김종명)add정보수정</note>
			<note>2003/05/06(서진숙)</note>
			<note>2003/06/18(이성헌)</note>
			<note>domain추가</note>
			</mnt_grp>
		<see></see>
		<morph_grp>
			<var type="temp"></var>
			<str type="temp"></str>
			<org lg="en">pause</org>
		
			<hom exist="yes"/>
			<der pos="temp" type="temp"></der>
			<comp pos="temp" type="temp"></comp>
			<metc pos="temp" type="temp"></metc>
			<img type="temp"></img>
		</morph_grp>
		<idm_grp>
			<idm type="temp"></idm>
		</idm_grp>
		<sense n="1">
			<sem_grp>
				<eg>선생님께서는 두 소절 사이에 ~가 있다는 것을 강조하셨다.</eg>
				<eg>악보에 있는 ~를 보지 못하고 연주를 해서 점수가 깎였다.</eg>
				<trans>pause</trans>
				<domain>음악</domain>
				<reg></reg>
				<con></con>
				<sem_class>기호</sem_class>
				<lr>
					<syn type="temp"></syn>
					<ant type="temp"></ant>
					<rel></rel>
				</lr>
			</sem_grp>
			<syn_grp>
				<comb_aj type="temp"></comb_aj>
				<comb_n type="temp"></comb_n>
				<comb_v type="narg_vpred">
					<form vcompound="no">~를 두다</form>
					<frame></frame>
				</comb_v>
				<max_n_str></max_n_str>
				<sel_rst arg="temp"></sel_rst>
				<cl type="temp"></cl>
				<prt></prt>
				<av></av>
				<pre_d/>
				<pre_n/>
				<s_n/>
			</syn_grp>
		</sense>
	</entry>
	<entry n="2" pos="nng_s">
		<mnt_grp>
			<cre>
				<cre_date>2002/08/23</cre_date>
				<cre_writer>김미현</cre_writer>
				<cre_note></cre_note>
			</cre>
			<mod>
				<mod_date>2003/06/18</mod_date>
				<mod_writer>이성헌</mod_writer>
				<mod_note></mod_note>
			</mod>
			<mod>
				<mod_date>2005/08/31</mod_date>
				<mod_writer>전미현</mod_writer>
				<mod_note></mod_note>
			</mod>
                        <mod>
                                <mod_date>2005/10/06</mod_date>
                                <mod_writer>박만규</mod_writer>
                                <mod_note></mod_note>
                        </mod>
                        <mod>
				<mod_date>2007/10/03</mod_date>
				<mod_writer>하신영</mod_writer>
				<mod_note></mod_note>
			</mod>
			<note>2002/09/09(박동호).2002/10/11(김종명)의미부류.동사연어정보수정</note>
			<note>2003/05/06(서진숙)</note>
			<note>2003/06/18(이성헌)sem을 행위에서 '몸짓및동작'으로 수정</note>
			<note>add의 '취하다'를 comb_v로 이동</note>
			<add></add>
		</mnt_grp>
		<see></see>
		<morph_grp>
			<var type="temp"></var>
			<str type="temp"></str>
			<org lg="en">pose</org>
		
			<hom exist="yes"/>
			<der pos="temp" type="temp"></der>
			<comp pos="temp" type="temp"></comp>
			<metc pos="temp" type="temp"></metc>
			<img type="temp"></img>
		</morph_grp>
		<idm_grp>
			<idm type="temp"></idm>
		</idm_grp>
		<sense n="1">
			<sem_grp>
				<eg>그 배우는 카메라 앞에서 매혹적인 ~를 취했다.</eg>
				<eg>나는 사진사의 요구대로 근엄하게 웃는 ~를 취했다.</eg>
				<eg>언니는 재미있는 ~를 좋아했었다.</eg>
				<trans>pose</trans>
				<domain></domain>
				<reg></reg>
				<con></con>
				<sem_class>몸짓및동작</sem_class>
				<lr>
					<syn type="temp"></syn>
					<ant type="temp"></ant>
					<rel></rel>
				</lr>
			</sem_grp>
			<syn_grp>
				<comb_aj type="appr">~가 아름답다</comb_aj>
				<comb_aj type="appr">~가 멋있다</comb_aj>
				<comb_n type="temp"></comb_n>
				<comb_v type="npred_vpred">
					<form vcompound="no">~를 취하다</form>
					<frame></frame>
				</comb_v>
				<max_n_str></max_n_str>
				<sel_rst arg="temp"></sel_rst>
				<cl type="temp"></cl>
				<prt></prt>
				<av></av>
				<pre_d/>
				<pre_n/>
				<s_n/>
			</syn_grp>
		</sense>
	</entry>
</superEntry>