<?xml version="1.0" encoding="euc-kr" standalone="no"?>
<!DOCTYPE superEntry SYSTEM "2007nn.dtd">
<superEntry>
	<orth>바지락</orth>
	<entry n="1" pos="nng_s">
		<mnt_grp>
			<cre>
				<cre_date>2003/07/11</cre_date>
				<cre_writer>송인욱</cre_writer>
			</cre>
			<mod>
				<mod_date>2003/10/13</mod_date>
				<mod_writer>박진호</mod_writer>
			</mod>
			<mod>
				<mod_date>2004/11/06</mod_date>
				<mod_writer>서진숙</mod_writer>
				<mod_note>예문 수정</mod_note>
			</mod>
			<mod>
				<mod_date>2004/11/07</mod_date>
				<mod_writer>김이정</mod_writer>
				<mod_note></mod_note>
			</mod>
			<mod>
				<mod_date>2007/08/22</mod_date>
				<mod_writer>김이정</mod_writer>
				<mod_note></mod_note>
			</mod>
			<note>2003/10/13(박진호)합성어 추가</note>
			<add>2003/08/08(송인욱)센스1의 동사자유구성으로 '~을 캐다|잡다|키우다|양식하다</add>
			<add>~이 살다|서식하다|죽다' 추가</add>
			<add>2003/08/08(송인욱)센스2의 동사자유구성으로 '~을 먹다' 추가</add>
		</mnt_grp>
		<morph_grp>
		
			<hom exist="yes"/>
			<comp pos="n" type="suffix">~칼국수</comp>
		</morph_grp>
		<idm_grp>
		</idm_grp>
		<sense n="1">
			<sem_grp>
				<eg>해녀들은 개펄에서 ~을 한 움큼씩 캐어 왔다.</eg>
				<eg>~은 주로 저 섬 앞바다에 서식하고 있다.</eg>
				<trans>short-necked clam</trans>
				<trans>Mactra veneriformis</trans>
				<sem_class>패류</sem_class>
				<lr>
					<syn type="perfect">바지락조개</syn>
					<syn type="perfect">바지라기</syn>
					<syn type="perfect">바지랑이</syn>
					<hyper>조개</hyper>
				</lr>
			</sem_grp>
			<syn_grp>
				<comb_aj type="magn">~이 많다</comb_aj>
				<comb_aj type="magn">~이 풍부하다</comb_aj>
				<comb_aj type="min">~이 적다</comb_aj>
				<comb_v type="narg_vpred">
					<form vcompound="no">~을 캐다</form>
				</comb_v>
				<comb_v type="narg_vpred">
					<form vcompound="no">~을 잡다</form>
				</comb_v>
				<comb_v type="narg_vpred">
					<form vcompound="no">~을 키우다</form>
				</comb_v>
				<comb_v type="narg_vpred">
					<form vcompound="no">~을 양식하다</form>
				</comb_v>
				<comb_v type="narg_vpred">
					<form vcompound="no">~이 살다</form>
				</comb_v>
				<comb_v type="narg_vpred">
					<form vcompound="no">~이 서식하다</form>
				</comb_v>
				<comb_v type="narg_vpred">
					<form vcompound="no">~이 죽다</form>
				</comb_v>
				<cl type="uni">마리</cl>
			</syn_grp>
		</sense>
		<sense n="2">
			<sem_grp>
				<eg>숯불에 구워 먹는 ~의 맛은 정말 일품이다.</eg>
				<eg>~을 날로 먹으면 비브리오 패혈증에 걸릴 위험이 있다.</eg>
				<trans>short-necked clam</trans>
				<trans>Mactra veneriformis</trans>
				<sem_class>자연음식물</sem_class>
				<lr>
					<syn type="perfect">바지락조개</syn>
					<syn type="perfect">바지라기</syn>
					<syn type="perfect">바지랑이</syn>
					<hyper>조개</hyper>
				</lr>
			</sem_grp>
			<syn_grp>
				<comb_aj type="appr">~이 맛있다</comb_aj>
				<comb_aj type="appr">~이 맛없다</comb_aj>
				<comb_aj type="appr">~이 질기다</comb_aj>
				<comb_aj type="appr">~이 부드럽다</comb_aj>
				<comb_v type="narg_vpred">
					<form vcompound="no">~을 먹다</form>
				</comb_v>
				<cl type="uni">마리</cl>
			</syn_grp>
		</sense>
	</entry>
	<entry n="2" pos="nng_s">
		<mnt_grp>
			<cre>
				<cre_date>2003/07/11</cre_date>
				<cre_writer>송인욱</cre_writer>
			</cre>
			<mod>
				<mod_date>2003/10/13</mod_date>
				<mod_writer>박진호</mod_writer>
			</mod>
			<mod>
				<mod_date>2004/11/06</mod_date>
				<mod_writer>서진숙</mod_writer>
				<mod_note></mod_note>
			</mod>
			<mod>
				<mod_date>2004/11/07</mod_date>
				<mod_writer>김이정</mod_writer>
				<mod_note></mod_note>
			</mod>
			<mod>
				<mod_date>2007/08/22</mod_date>
				<mod_writer>김이정</mod_writer>
				<mod_note>n_v 기술</mod_note>
			</mod>
		</mnt_grp>
		<see>바자</see>
		<morph_grp>
			<var type="xs">바자</var>
		
			<hom exist="yes"/>
		</morph_grp>
		<idm_grp>
		</idm_grp>
		<sense n="1">
			<sem_grp>
				<eg>오전에는 그물을 친 해변에서 ~을 잡는 행사가 있다.</eg>
				<trans></trans>
				<sem_class>패류</sem_class>
				<lr>
				</lr>
			</sem_grp>
			<syn_grp>
				<comb_v type="narg_vpred">
					<form vcompound="no">~을 캐다</form>
				</comb_v>
				<comb_v type="narg_vpred">
					<form vcompound="no">~을 잡다</form>
				</comb_v>
			</syn_grp>
		</sense>
	</entry>
</superEntry>