<?xml version="1.0" encoding="euc-kr" standalone="no"?>
<!DOCTYPE superEntry SYSTEM "2007nn.dtd">
<superEntry>
	<orth>반반</orth>
	<entry n="1" pos="nng_s">
		<mnt_grp>
			<cre>
				<cre_date>2003/08/13</cre_date>
				<cre_writer>송인욱</cre_writer>
			</cre>
			<mod>
				<mod_date>2003/10/15</mod_date>
				<mod_writer>박진호</mod_writer>
			</mod>
			<mod>
				<mod_date>2004/11/06</mod_date>
				<mod_writer>서진숙</mod_writer>
				<mod_note></mod_note>
			</mod>
			<mod>
				<mod_date>2004/11/08</mod_date>
				<mod_writer>김이정</mod_writer>
				<mod_note></mod_note>
			</mod>
			<note>2003/08/13(송인욱)의미부류 검토 요망</note>
			<note>2003/10/15(박진호)부사적 용법 추가. 센스 세분 가능성 있음</note>
		</mnt_grp>
		<morph_grp>
			<org lg="si">半半</org>
		
		</morph_grp>
		<idm_grp>
		</idm_grp>
		<sense n="1">
			<sem_grp>
				<eg>우리가 그 시험에 통과할 가능성은 ~이었다.</eg>
				<eg>그들은 훔친 물건을 공평하게 ~으로 나누었다.</eg>
				<trans>half-and-half</trans>
				<trans>fifty-fifty</trans>
				<sem_class>부분</sem_class>
				<lr>
				</lr>
			</sem_grp>
			<syn_grp>
				<av>~으로</av>
				<av>~씩</av>
			</syn_grp>
		</sense>
	</entry>
</superEntry>