<?xml version="1.0" encoding="euc-kr" standalone="no"?>
<!DOCTYPE superEntry SYSTEM "2007nn.dtd">
<superEntry>
	<orth>빛</orth>
	<entry n="1" pos="nng_s">
		<mnt_grp>
			<cre>
				<cre_date>2001/07/28</cre_date>
				<cre_writer>차준경</cre_writer>
			</cre>
			<mod>
				<mod_date>2001/07/31</mod_date>
				<mod_writer>차준경강범모</mod_writer>
				<mod_note>일차교정</mod_note>
			</mod>
			<mod>
				<mod_date>2001/08/03</mod_date>
				<mod_writer>차준경</mod_writer>
				<mod_note>이차교정</mod_note>
			</mod>
			<mod>
				<mod_date>2003/03/22</mod_date>
				<mod_writer>고길수</mod_writer>
				<mod_note>센스1의 예문 수정</mod_note>
				<mod_note>의미부류 정보 수정</mod_note>
				<mod_note>단위표현 정보 추가</mod_note>
				<mod_note>comb_aj에 '환하다|눈부시다' 추가</mod_note>
				<mod_note>센스1의 comb_v 정보를 add로 수정</mod_note>
				<mod_note>센스1의 명사연어를 add로 수정</mod_note>
				<mod_note>센스2에 단위표현 추가</mod_note>
				<mod_note>센스2의 형용사자유구성 정보 추가</mod_note>
				<mod_note>comb_v 정보 추가</mod_note>
				<mod_note>comb_v의 '바래다'는 add로 수정</mod_note>
				<mod_note>센스3의 의미부류를 '속성'에서 '태도'로 수정</mod_note>
				<mod_note>센스3의 comb_aj에 '역력하다|뚜렷하다' 추가</mod_note>
				<mod_note>센스3에 comb_v 정보 추가</mod_note>
				<mod_note>add에 센스3의 동사정보 추가</mod_note>
				<mod_note>센스3에 pre_s 정보 추가</mod_note>
				<mod_note>센스4 추가</mod_note>
			</mod>
			<mod>
				<mod_date>2003/04/07</mod_date>
				<mod_writer>고길수</mod_writer>
				<mod_note>센스2의 단위표현에서 '개' 삭제</mod_note>
				<mod_note>센스4에 동의어 추가</mod_note>
				<mod_note>센스7에 동의어 추가</mod_note>
				<mod_note>센스1의 단위표현을 '부분'에서 '양'로 수정</mod_note>
			</mod>
			<mod>
				<mod_date>2003/05/15</mod_date>
				<mod_writer>고길수</mod_writer>
				<mod_note>2003/05/15(고길수)센스1에 magn 정보 추가</mod_note>
				<mod_note>센스2에 단위표현 추가</mod_note>
				<mod_note>센스5를 센스3으로 수정</mod_note>
				<mod_note>센스5, 6에 pre_s 정보 추가</mod_note>
			</mod>
			<mod>
				<mod_date>2004/09/21</mod_date>
				<mod_writer>목정수</mod_writer>
				<mod_note></mod_note>
			</mod>
			<mod>
				<mod_date>2004/11/19</mod_date>
				<mod_writer>이성헌</mod_writer>
				<mod_note></mod_note>
			</mod>
			<mod>
				<mod_date>2004/12/27</mod_date>
				<mod_writer>고길수</mod_writer>
				<mod_note>센스1,2,3에 논항명사구, 논항 의미정보 추가</mod_note>
				<mod_note>센스3,4의 동사결합 정보 수정</mod_note>
			</mod>
			<add>센스2의 동사결합으로 '~이 바래다|나다,~을 내다' 추가</add>
			<add>센스5의 동사결합으로 '~이 감돌다'</add>
			<add>센스5의 명사구로 '긴장의 ~'</add>
			<add>센스1의 명사구 '~(의) 줄기,~의 굴절'</add>
			<add>센스4의 동사결합으로 '~이 깊어지다|달라지다,~을 감추다' 추가</add>
			<add>센스7의 동사결합으로 '~을 주다,~이 되다' 추가</add>
			<add>센스1의 동사결합 '~을 비추다|발하다|내다,~이 환하다|들다|나다'</add>
			<add>센스6의 동사결합으로 '~을 발하다|띠다|내다,~이 나다'</add>
		</mnt_grp>
		<morph_grp>
		
			<comp pos="n" type="suffix">~살</comp>
			<comp pos="n" type="prefix">별~</comp>
			<comp pos="n" type="prefix">달~</comp>
			<comp pos="v" type="suffix">~나다</comp>
		</morph_grp>
		<idm_grp>
		</idm_grp>
		<sense n="1">
			<sem_grp>
				<eg>아침해가 떠오르면 방안으로 환한 ~이 쏟아져 들어왔다.</eg>
				<trans>light</trans>
				<curs type="U"/>
				<sem_class>빛</sem_class>
				<lr>
					<syn>광선</syn>
				</lr>
			</sem_grp>
			<syn_grp>
				<comb_aj type="appr">~이 밝다</comb_aj>
				<comb_aj type="appr">~이 희미하다</comb_aj>
				<comb_aj type="appr">~이 환하다</comb_aj>
				<comb_aj type="appr">~이 눈부시다</comb_aj>
				<comb_aj type="magn">~이 강하다</comb_aj>
				<comb_aj type="magn">~이 강렬하다</comb_aj>
				<comb_aj type="magn">~이 약하다</comb_aj>
				<comb_v type="npred_vpred"> <!-- 추가함 -->
					<form vcompound="no">~을 비추다</form>
					<frame></frame>
				</comb_v>
				<comb_v type="npred_vpred"> <!-- 추가함 -->
					<form vcompound="no">~을 발하다</form>
					<frame></frame>
				</comb_v>
				<comb_v type="npred_vpred"> <!-- 추가함 -->
					<form vcompound="no">~을 내다</form>
					<frame></frame>
				</comb_v>
				<comb_v type="npred_vpred"> <!-- 추가함 -->
					<form vcompound="no">~이 들다</form>
					<frame></frame>
				</comb_v>
				<comb_v type="npred_vpred"> <!-- 추가함, 단 기능동사 변이형이 아닌지 검토 필요 -->
					<form vcompound="no">~이 나다</form>
					<frame></frame>
				</comb_v>
				<max_n_str>X-의 ~</max_n_str> <!-- 추가함 -->
				<sel_rst arg="X">천체|조명기구</sel_rst> <!-- 추가함 -->
				<cl type="qnt">줄기</cl>
				<cl type="qnt">가닥</cl>
			</syn_grp>
		</sense>
		<sense n="2">
			<sem_grp>
				<eg>옷을 오래 입어서 ~이 바래졌다.</eg>
				<trans>color</trans>
				<trans>hue</trans>
				<trans>tint</trans>
				<trans>shade</trans>
				<curs type="U"/>
				<sem_class>속성</sem_class>
				<lr>
					<syn type="etc">색깔</syn>
				</lr>
			</sem_grp>
			<syn_grp>
				<comb_aj type="appr">~이 환하다</comb_aj>
				<comb_aj type="appr">~이 파랗다</comb_aj>
				<comb_aj type="appr">~이 푸르다</comb_aj>
				<comb_aj type="appr">~이 화려하다</comb_aj>
				<comb_aj type="appr">~이 칙칙하다</comb_aj>
				<comb_v type="narg_vpred"> <!-- 추가함 -->
					<form vcompound="no">~이 바래다</form>
					<frame></frame>
				</comb_v>
				<comb_v type="narg_vpred"> <!-- 추가함 -->
					<form vcompound="no">~이 나다</form>
					<frame></frame>
				</comb_v>
				<max_n_str>X-의 ~</max_n_str> <!-- 추가함 -->
				<sel_rst arg="X">구체물|장소</sel_rst> <!-- 추가함 -->
				<cl type="uni">개</cl>
				<cl type="uni">가지</cl>
			</syn_grp>
		</sense>
		<sense n="3">
			<sem_grp>
				<eg>그의 시계에 박힌 보석들은 찬란한 ~을 내뿜고 있었다.</eg>
				<eg>바닥을 몇 번 문질렀더니 번쩍번쩍 ~이 나기 시작했다.</eg>
				<eg>내가 나타나자 그의 눈에서는 ~으로 번뜩였다.</eg>
				<trans>sparkle</trans>
				<sem_class>빛</sem_class>
				<lr>
					<syn type="etc">광채</syn>
				</lr>
			</sem_grp>
			<syn_grp>
				<comb_aj type="appr">~이 찬란하다</comb_aj>
				<comb_v type="npred_vpred"> <!-- narg_vpred 수정 -->
					<form>~을 내다</form>
					<frame>X-이 ~을 내다</frame> <!-- 추가 -->
				</comb_v>
				<comb_v type="npred_vpred"> <!-- narg_vpred 수정 -->
					<form>~을 띠다</form>
					<frame>X-이 ~을 띠다</frame> <!-- 추가 -->
				</comb_v>
				<comb_v type="npred_vsupvar"> <!-- narg_vpred 수정 -->
					<form>~이 나다</form>
					<frame>X-이 ~이 나다</frame> <!-- 추가 -->
				</comb_v>
				<max_n_str>X-의 ~</max_n_str> <!-- 추가함 -->
				<sel_rst arg="X">구체물</sel_rst> <!-- 추가함 -->
				<cl type="qnt">줄기</cl>
				<cl type="qnt">가닥</cl>
			</syn_grp>
		</sense>
		<sense n="4">
			<sem_grp>
				<eg>아들이 상을 타서 엄마가 기쁜 ~을 감추지 못했다.</eg>
				<trans>look</trans>
				<curs type="U"/>
				<sem_class>기색</sem_class> <!-- 태도 수정 -->
				<lr>
					<syn type="etc">안색</syn>
					<syn type="etc">태도</syn>
				</lr>
			</sem_grp>
			<syn_grp>
				<comb_aj type="appr">기쁜 ~</comb_aj>
				<comb_aj type="appr">난처한 ~</comb_aj>
				<comb_aj type="appr">걱정스러운 ~</comb_aj>
				<comb_aj type="appr">~이 역력하다</comb_aj>
				<comb_aj type="appr">~이 뚜렷하다</comb_aj>
				<comb_n type="compound">경계의 ~</comb_n>
				<comb_n type="compound">실망의 ~</comb_n>
				<comb_n type="compound">우려의 ~</comb_n>
				<comb_v type="npred_vpred"> <!-- narg_vpred 수정 -->
					<form>~을 보이다</form>
				</comb_v>
				<comb_v type="npred_vpred"> <!-- narg_vpred 수정 -->
					<form>~을 띠다</form>
				</comb_v>
				<comb_v type="npred_vpred"> <!-- narg_vpred 수정 -->
					<form>~을 내다</form>
				</comb_v>
				<comb_v type="npred_vpred"> <!-- narg_vpred 수정 -->
					<form>~이 보이다</form>
				</comb_v>
				<comb_v type="npred_vpred"> <!-- narg_vpred 수정 -->
					<form>~이 나타나다</form>
				</comb_v>
				<s_n>S는 ~</s_n> <!-- 수식어 성분이 필수적으로 요구되는 듯 -->
			</syn_grp>
		</sense>
		<sense n="5">
			<sem_grp>
				<eg>순간 교실에는 긴장의 ~이 감돌았다.</eg>
				<trans>atmosphere</trans>
				<sem_class>현상</sem_class> <!-- 속성 수정 -->
				<lr>
					<syn type="etc">분위기</syn>
				</lr>
			</sem_grp>
			<syn_grp>
				<comb_aj type="appr">쓸쓸한 ~</comb_aj>
				<comb_v type="npred_vpred"> <!-- 추가함 -->
					<form vcompound="no">~이 감돌다</form>
					<frame></frame>
				</comb_v>
				<s_n>S는 ~</s_n> <!-- 수식어 성분이 필수적인 듯 -->
			</syn_grp>
		</sense>
		<sense n="6">
			<sem_grp>
				<eg>그의 작품은 사람을 매료하는 독특한 ~을 발한다.</eg>
				<trans>splendor</trans>
				<trans>brilliance</trans>
				<sem_class>속성값</sem_class> <!-- 능력 수정 -->
				<lr>
				</lr>
			</sem_grp>
			<syn_grp>
				<comb_v type="npred_vpred"> <!-- 추가함 -->
					<form vcompound="no">~을 발하다</form>
					<frame></frame>
				</comb_v>
				<comb_v type="npred_vpred"> <!-- 추가함 -->
					<form vcompound="no">~을 뿜다</form>
					<frame></frame>
				</comb_v>
				<s_n>S는 ~</s_n> <!-- 수식어 성분 필수적인 듯 -->
			</syn_grp>
		</sense>
		<sense n="7">
			<sem_grp>
				<eg>희망의 ~이 밝아오고 있으니 모두 열심히 일을 합시다.</eg>
				<eg>그는 암울한 시대에 민중들에게 힘과 ~을 주었다.</eg>
				<trans>hope</trans>
				<trans>bright future</trans>
				<curs type="U"/>
				<sem_class>추상적대상</sem_class>
				<lr>
					<syn type="etc">희망</syn>
				</lr>
			</sem_grp>
			<syn_grp>
				<comb_n type="compound">희망의 ~</comb_n>
				<comb_v type="narg_vpred"> <!-- 추가함 -->
					<form vcompound="no">~을 주다</form>
					<frame></frame>
				</comb_v>
			</syn_grp>
		</sense>
	</entry>
</superEntry>