<?xml version="1.0" encoding="euc-kr" standalone="no"?>
<!DOCTYPE superEntry SYSTEM "2007nn.dtd">

<superEntry>
	<orth>선고</orth>
	<entry n="1" pos="nng_s">
		<mnt_grp>
			<cre>
				<cre_date>2002/05/24</cre_date>
				<cre_writer>이지영</cre_writer>
				<cre_note></cre_note>
			</cre>
			<mod>
				<mod_date>2003/06/18</mod_date>
				<mod_writer>목정수</mod_writer>
				<mod_note></mod_note>
			</mod>
			<mod>
				<mod_date>2005/10/10</mod_date>
				<mod_writer>이광호</mod_writer>
				<mod_note></mod_note>
			</mod>
			<mod>
				<mod_date>2005/10/31</mod_date>
				<mod_writer>김이정</mod_writer>
				<mod_note>'분' 삭제</mod_note>
			</mod>
			<mod>
				<mod_date>2007/08/12</mod_date>
				<mod_writer>고길수</mod_writer>
				<mod_note>맥스엔, 선택제약 정보 추가</mod_note>
			</mod>
			<note>2002/10/14(박진호)</note>
			<note>2003/05/21(김미순)</note>
			<note>2003/06/18(목정수)</note>
			<add></add>
		</mnt_grp>
		<see></see>
		<morph_grp>
			<var type="temp"></var>
			<str type="temp"></str>
			<org lg="si">先考</org>
			<hom exist="yes"/>
			<der pos="temp" type="temp"></der>
			<comp pos="temp" type="temp"></comp>
			<metc pos="temp" type="temp"></metc>
			<img type="temp"></img>
		</morph_grp>
		<idm_grp>
			<idm type="temp"></idm>
		</idm_grp>
		<sense n="1">
			<sem_grp>
				<eg>~께서는 우리를 늘 사랑으로 감싸셨습니다.</eg>
				<trans>deceased father</trans>
				<domain></domain>
				<reg></reg>
				<con></con>
				<sem_class>비대칭적친족</sem_class>
				<lr>
					<syn type="temp"></syn>
					<ant type="temp"></ant>
					<rel></rel>
				</lr>
			</sem_grp>
			<syn_grp>
				<comb_aj type="temp"></comb_aj>
				<comb_n type="temp"></comb_n>
				<comb_v type="temp">
					<form vcompound="temp"></form>
					<frame></frame>
				</comb_v>
				<max_n_str>X-의 ~</max_n_str>
				<max_n_str>X ~</max_n_str>
				<sel_rst arg="X">인간</sel_rst>
				<cl type="uni"></cl>
				<prt></prt>
				<av></av>
				<pre_d/>
				<pre_n/>
				<s_n/>
			</syn_grp>
		</sense>
	</entry>
	<entry n="2" pos="nng_s">
		<mnt_grp>
			<cre>
				<cre_date>2002/05/24</cre_date>
				<cre_writer>이지영</cre_writer>
				<cre_note></cre_note>
			</cre>
			<mod>
				<mod_date>2003/06/18</mod_date>
				<mod_writer>목정수</mod_writer>
				<mod_note></mod_note>
			</mod>
			<mod>
				<mod_date>2005/10/10</mod_date>
				<mod_writer>이광호</mod_writer>
				<mod_note></mod_note>
			</mod>
			<mod>
				<mod_date>2005/10/31</mod_date>
				<mod_writer>김이정</mod_writer>
				<mod_note>센스1,2 s_n 삭제;센스1,2 n_v, 최대논항구조 수정</mod_note>
			</mod>
			<mod>
				<mod_date>2007/08/12</mod_date>
				<mod_writer>고길수</mod_writer>
				<mod_note>센스1의 프레임 정보의 'S다는' 수정;보문 논항 추가;'내리다' 유형값 수정, 프레임 정보 추가;맥스엔 수정 및 추가;선택제약 정보 수정;센스2의 전문영역에서 법률 삭제;프레임 정보의 'S라는' 수정;'받다'에 조사 변이형 추가;'내리다' 유형값 수정, 프레임 정보 추가;맥스엔 보완;선택제약 정보 수정</mod_note>
			</mod>
			<note>2002/10/14(박진호)</note>
			<note>2003/05/21(김미순)sense 1 comb_v에서 '~를 받다' 삭제</note>
			<note>2003/06/18(목정수)cor_v에 받다추가</note>
			<note>comb_v에서 '~를 받다' 삭제</note>
			<note>sel_res 수정</note>
			<note>sense 2 예문수정</note>
			<note>supv 수정 '~를 받다' 구문 추가</note>
			<add></add>
		</mnt_grp>
		<see></see>
		<morph_grp>
			<var type="temp"></var>
			<str type="temp"></str>
			<org lg="si">宣告</org>
			<hom exist="yes"/>
			<der pos="temp" type="temp"></der>
			<comp pos="temp" type="temp"></comp>
			<metc pos="temp" type="temp"></metc>
			<img type="temp"></img>
		</morph_grp>
		<idm_grp>
			<idm type="temp"></idm>
		</idm_grp>
		<sense n="1">
			<sem_grp>
				<eg>그는 의사로부터 시한부 ~를 받았다.</eg>
				<trans>pronouncement</trans>
				<domain></domain>
				<reg></reg>
				<con></con>
				<sem_class>보고제안</sem_class>
				<lr>
					<syn type="temp"></syn>
					<ant type="temp"></ant>
					<rel></rel>
				</lr>
			</sem_grp>
			<syn_grp>
				<comb_aj type="temp"></comb_aj>
				<comb_n type="temp"></comb_n>
				<comb_v type="npred_vsup">
					<form vcompound="yes">~를 하다</form>
					<frame>X-이 Z-에게 Y-을 ~를 하다</frame>
					<frame>X-이 Z-에게 S것-을 ~를 하다</frame>
					<frame>X-이 Z-에게 S다고 ~를 하다</frame>
					<frame>X-이 Z-에게 S라고 ~를 하다</frame>
				</comb_v>
				<comb_v type="npred_vsup">
					<form vcompound="yes">~가 되다</form>
					<frame>Z-에게 Y-이 ~가 되다</frame>
					<frame>Z-에게 S것-이 ~가 되다</frame>
					<frame>Z-에게 S다고 ~가 되다</frame>
					<frame>Z-에게 S라고 ~가 되다</frame>
				</comb_v>
				<comb_v type="npred_vsup">
					<form vcompound="yes">~를 받다</form>
					<frame>Z-이 X-로부터 Y-을 ~를 받다</frame>
					<frame>Z-이 X-로부터 S것-을 ~를 받다</frame>
					<frame>Z-이 X-로부터 S다고 ~를 받다</frame>
					<frame>Z-이 X-로부터 S라고 ~를 받다</frame>
					<frame>Z-이 X-에게서 Y-을 ~를 받다</frame>
					<frame>Z-이 X-에게서 S것-을 ~를 받다</frame>
					<frame>Z-이 X-에게서 S다고 ~를 받다</frame>
					<frame>Z-이 X-에게서 S라고 ~를 받다</frame>
					<frame>Z-이 X-에게 Y-을 ~를 받다</frame>
					<frame>Z-이 X-에게 S것-을 ~를 받다</frame>
					<frame>Z-이 X-에게 S다고 ~를 받다</frame>
					<frame>Z-이 X-에게 S라고 ~를 받다</frame>
				</comb_v>
				<comb_v type="npred_vsupvar">
					<form vcompound="no">~를 내리다</form>
					<frame>X-이 Z-에게 Y-을 ~를 내리다</frame>
					<frame>X-이 Z-에게 S것-을 ~를 내리다</frame>
					<frame>X-이 Z-에게 S다고 ~를 내리다</frame>
					<frame>X-이 Z-에게 S라고 ~를 내리다</frame>
				</comb_v>
				<!--vcompound: ~하다-->
				<!--vcompound: ~되다-->
				<!--vcompound: ~받다-->
				<max_n_str>X-의 Z-에대한 Y ~</max_n_str>
				<max_n_str>X-의 Z-에대한 S다는 ~</max_n_str>
				<max_n_str>X-의 Z-에대한 S라는 ~</max_n_str>
				<max_n_str>X-의 Y ~</max_n_str>
				<max_n_str>X-의 S다는 ~</max_n_str>
				<max_n_str>X-의 S라는 ~</max_n_str>
				<max_n_str>Z-에대한 Y ~</max_n_str>
				<max_n_str>Z-에대한 S다는 ~</max_n_str>
				<max_n_str>Z-에대한 S라는 ~</max_n_str>
				<max_n_str>X-의 ~</max_n_str>
				<max_n_str>Y ~</max_n_str>
				<max_n_str>S다는 ~</max_n_str>
				<max_n_str>S라는 ~</max_n_str>
				<sel_rst arg="X">직업인간</sel_rst>
				<sel_rst arg="Y">질병및증세|행위</sel_rst>
				<sel_rst arg="Z">인간|일시적집단</sel_rst>
				<cl type="uni">번</cl>
				<cl type="uni">회</cl>
				<cl type="uni">차례</cl>
				<prt></prt>
				<av></av>
				<pre_d/>
				<pre_n/>
				<s_n></s_n>
			</syn_grp>
		</sense>
		<sense n="2">
			<sem_grp>
				<eg>피고는 판사로부터 5년 징역의 ~를 받았다.</eg>
				<trans>sentence</trans>
				<domain></domain>
				<reg></reg>
				<con></con>
				<sem_class>명령</sem_class>
				<lr>
					<syn type="temp"></syn>
					<ant type="temp"></ant>
					<rel></rel>
				</lr>
			</sem_grp>
			<syn_grp>
				<comb_aj type="temp"></comb_aj>
				<comb_n type="temp"></comb_n>
				<comb_v type="npred_vsup">
					<form vcompound="yes">~를 하다</form>
					<frame>X-이 Z-에게 W-에대해서 Y-을 ~를 하다</frame>
					<frame>X-이 Z-에게 W-에대해서 S라고 ~를 하다</frame>
				</comb_v>
				<comb_v type="npred_vsup">
					<form vcompound="yes">~가 되다</form>
					<frame>Z-에게 Y-이 ~가 되다</frame>
					<frame>Z-에게 S라고~가 되다</frame>
				</comb_v>
				<comb_v type="npred_vsup">
					<form vcompound="yes">~를 받다</form>
					<frame>Z-이 X-로부터 Y-을 ~를 받다</frame>
					<frame>Z-이 X-로부터 S라고 ~를 받다</frame>
					<frame>Z-이 X-에게서 Y-을 ~를 받다</frame>
					<frame>Z-이 X-에게서 S라고 ~를 받다</frame>
					<frame>Z-이 X-에게 Y-을 ~를 받다</frame>
					<frame>Z-이 X-에게 S라고 ~를 받다</frame>
				</comb_v>
				<comb_v type="npred_vsupvar">
					<form vcompound="no">~를 내리다</form>
					<frame>X-이 Z-에게 W-에대해서 Y-을 ~를 내리다</frame>
					<frame>X-이 Z-에게 W-에대해서 S라고 ~를 내리다</frame>
				</comb_v>
				<!--vcompound: ~하다-->
				<!--vcompound: ~되다-->
				<!--vcompound: ~받다-->
				<max_n_str>X-의 Z-에대한 Y ~</max_n_str>
				<max_n_str>X-의 Z-에대한 S라는 ~</max_n_str>
				<max_n_str>X-의 Y ~</max_n_str>
				<max_n_str>X-의 S라는 ~</max_n_str>
				<max_n_str>Z-에대한 Y ~</max_n_str>
				<max_n_str>Z-에대한 S라는 ~</max_n_str>
				<max_n_str>X-의 ~</max_n_str>
				<max_n_str>Y ~</max_n_str>
				<max_n_str>S라는 ~</max_n_str>
				<sel_rst arg="X">직업인간(판사)|일시적역할인간(재판장)</sel_rst>
				<sel_rst arg="Y">벌|금전(벌금)|처벌|단독행위(징역)|속성값(유죄|무죄)</sel_rst>
				<sel_rst arg="W">범죄및비행|사고|사회갈등</sel_rst>
				<sel_rst arg="Z">인간(피고)</sel_rst>
				<cl type="uni">번</cl>
				<cl type="uni">회</cl>
				<cl type="uni">차례</cl>
				<prt></prt>
				<av></av>
				<pre_d/>
				<pre_n/>
				<s_n></s_n>
			</syn_grp>
		</sense>
	</entry>
</superEntry>