<?xml version="1.0" encoding="euc-kr" standalone="no"?>
<!DOCTYPE superEntry SYSTEM "2007nn.dtd">
<superEntry>
	<orth>미숙</orth>
	<entry n="1" pos="nng_s">
		<mnt_grp>
			<cre>
				<cre_date>2003/07/07</cre_date>
				<cre_writer>송인욱</cre_writer>
			</cre>
			<mod>
				<mod_date>2003/10/10</mod_date>
				<mod_writer>박진호</mod_writer>
			</mod>
			<mod>
				<mod_date>2004/11/06</mod_date>
				<mod_writer>서진숙</mod_writer>
				<mod_note>lr수정</mod_note>
			</mod>
			<mod>
				<mod_date>2004/11/07</mod_date>
				<mod_writer>김이정</mod_writer>
				<mod_note>센스1과 2 반의어 기술</mod_note>
			</mod>
			<note>2003/07/07(송인욱)센스1의 의미부류를 '행위' 범주로 볼 수 있을까?</note>
			<note>센스2는 '미성숙'의 약어형인 듯 한데, 같은 엔트리이므로 일단 동의어 처리함</note>
			<note>2003/10/10(박진호)센스1 합성어 형용사 추가. 합성어 명사에 있던 것 명사연어로 옮김. 센스2 의미부류 수정</note>
		</mnt_grp>
		<morph_grp>
			<org lg="si">未熟</org>
		
			<comp pos="a" type="suffix">~하다</comp>
		</morph_grp>
		<idm_grp>
		</idm_grp>
		<sense n="1">
			<sem_grp>
				<eg>이번 비행기 추락 사고는 조종사의 조작 ~으로 인한 것이었다.</eg>
				<eg>그 사고는 아버지의 운전 ~에 기인하는 것이었다.</eg>
				<eg>국회의원들은 외교부 관리들의 협상 ~을 탓했다.</eg>
				<trans>inexperienced</trans>
				<trans>unskilled</trans>
				<trans>half-fledged</trans>
				<trans>poor</trans>
				<sem_class>속성값</sem_class>
				<lr>
					<syn type="kor">서투름</syn>
					<ant type="conv">숙달</ant>
				</lr>
			</sem_grp>
			<syn_grp>
				<comb_n type="compound">운전 ~</comb_n>
				<comb_n type="compound">조작 ~</comb_n>
				<av>~으로</av>
			</syn_grp>
		</sense>
		<sense n="2">
			<sem_grp>
				<eg>쓰레기 무단 투기는 시민의식의 ~을 단적으로 드러내는 사례이다.</eg>
				<eg>준법정신의 ~은 사회 혼란의 원인이 된다.</eg>
				<trans>immaturity</trans>
				<sem_class>상태</sem_class>
				<lr>
					<syn type="perfect">미성숙</syn>
					<ant type="conv">성숙</ant>
				</lr>
			</sem_grp>
			<syn_grp>
			</syn_grp>
		</sense>
	</entry>
</superEntry>