<?xml version="1.0" encoding="euc-kr" standalone="no"?>
<!DOCTYPE superEntry SYSTEM "2007nn.dtd">
<superEntry>
	<orth>프라이버시</orth>
	<entry n="1" pos="nng_s">
		<mnt_grp>
			<cre>
				<cre_date>2003/09/16</cre_date>
				<cre_writer>서진숙</cre_writer>
			</cre>
			<mod>
				<mod_date>2003/10/12</mod_date>
				<mod_writer>서진숙</mod_writer>
			</mod>
			<mod>
				<mod_date>2004/10/03</mod_date>
				<mod_writer>김이정</mod_writer>
				<mod_note>의미부류 '권리'를 '상황'으로 수정했으나 검토 요망;동의어 기술</mod_note>
			</mod>
			<mod>
				<mod_date>2004/11/01</mod_date>
				<mod_writer>이광호</mod_writer>
				<mod_note></mod_note>
			</mod>
			<mod>
				<mod_date>2005/02/15</mod_date>
				<mod_writer>김미현</mod_writer>
				<mod_note>동사 연어 추가</mod_note>
			</mod>
			<add>~를 존중하다|침범하다</add>
		</mnt_grp>
		<morph_grp>
			<org lg="en">privacy</org>
		
		</morph_grp>
		<idm_grp>
		</idm_grp>
		<sense n="1">
			<sem_grp>
				<eg>현대 사회에서는 타인의 ~를 침해해서는 안된다.</eg>
				<trans>privacy</trans>
				<sem_class>상황</sem_class><!--추상적대상?(김이정)-->
				<lr>
					<syn type="etc">사생활</syn>
				</lr>
			</sem_grp>
			<syn_grp>
				<comb_v type="narg_vpred">
					<form vcompound="no">~를 존중하다</form>
					<frame></frame>
				</comb_v>
				<comb_v type="narg_vpred">
					<form vcompound="no">~를 보호하다</form><!--추가(미현)-->
					<frame></frame>
				</comb_v>
				<comb_v type="narg_vpred">
					<form vcompound="no">~를 침범하다</form>
					<frame></frame>
				</comb_v>
			</syn_grp>
		</sense>
	</entry>
</superEntry>