<?xml version="1.0" encoding="euc-kr" standalone="no"?>
<!DOCTYPE superEntry SYSTEM "2007nn.dtd">
<superEntry>
	<orth>전면교육</orth>
	<entry pos="nng_c">
		<mnt_grp>
			<cre>
				<cre_date>2004/07/10</cre_date>
				<cre_writer>전미현</cre_writer>
				<cre_note>정확한 의미를 모르겠음</cre_note>
			</cre>
			<mod>
				<mod_date>2004/0/</mod_date>
				<mod_writer>이성헌</mod_writer>
				<mod_note></mod_note>
			</mod>
			<mod>
				<mod_date>2004/12/25</mod_date>
				<mod_writer>이홍식</mod_writer>
				<mod_note></mod_note>
			</mod>
			<mod>
				<mod_date>2007/09/17</mod_date>
				<mod_writer>이민우</mod_writer>
				<mod_note></mod_note>
			</mod>
			<add></add>
		</mnt_grp>
		<see></see>
		<morph_grp>
			<var type="etc"></var>
			<str type="N_N">전면_교육</str>
			<org lg="si">全面敎育</org>
		</morph_grp>
		<idm_grp>
			<idm type="etc"></idm>
		</idm_grp>
		<sense>
			<sem_grp>
				<eg></eg>
				<trans></trans>
				<domain></domain>
				<sem_class>방향성행위</sem_class>
				<lr>
					<syn type="etc"></syn>
					<ant type="etc"></ant>
				</lr>
			</sem_grp>
			<syn_grp>
				<comb_aj type="appr"></comb_aj>
				<comb_n type="compound"></comb_n>
				<comb_v type="npred_vsup">
					<form vcompound="yes">~을 하다</form>
					<frame>X-이 Y-를 ~을 하다</frame>
					<frame>X-이 Y-에게 ~을 하다</frame>
				</comb_v>
				<comb_v type="npred_vpred">
					<form vcompound="no">~이 필요하다</form>
				</comb_v>
				<max_n_str>X-의 Y-에 대한 ~</max_n_str>
				<sel_rst arg="X">인간|인간집단</sel_rst>
				<sel_rst arg="Y">인간|인간집단</sel_rst>
				<cl type="uni"></cl>
			</syn_grp>
		</sense>
	</entry>
</superEntry>