<?xml version="1.0" encoding="euc-kr" standalone="no"?>
<!DOCTYPE superEntry SYSTEM "2007nn.dtd">
<superEntry>
	<orth>아이콘</orth>
	<entry n="1" pos="nng_s">
		<mnt_grp>
			<cre>
				<cre_date>2003/10/20</cre_date>
				<cre_writer>기영인</cre_writer>
			</cre>
			<mod>
				<mod_date>2003/10/20</mod_date>
				<mod_writer>기영인</mod_writer>
			</mod>
			<mod>
				<mod_date>2004/10/31</mod_date>
				<mod_writer>권오희</mod_writer>
				<mod_note>센스1의 동사결합정보 기술</mod_note>
				<mod_note>n_n기술</mod_note>
				<mod_note>n_v 이하 기술</mod_note>
				<mod_note>add옮김</mod_note>
			</mod>
			<mod>
				<mod_date>2004/11/01</mod_date>
				<mod_writer>이광호</mod_writer>
				<mod_note></mod_note>
			</mod>
			<mod>
				<mod_date>2004/12/28</mod_date>
				<mod_writer>권오희</mod_writer>
				<mod_note>형식검토</mod_note>
			</mod>
			<mod>
				<mod_date>2007/07/29</mod_date>
				<mod_writer>호정은</mod_writer>
				<mod_note>동사결합 추가</mod_note>
				<mod_note>센스 2 추가</mod_note>
			</mod>
			<note>2003/10/20(기영인)센스2의 오표기 '이콘'(센스1은 아님) 별도 표시방법 없음</note>
			<note>센스2 추후 전문영역(종교/그리스정교) 상세화 필요</note>
		</mnt_grp>
		<morph_grp>
			<var type="xx">이콘</var>
			<org lg="en">icon</org>
		
		</morph_grp>
		<idm_grp>
		</idm_grp>
		<sense n="1">
			<sem_grp>
				<eg>이 ~을 누르면 명령이 바로 실행됩니다.</eg>
				<trans>icon</trans>
				<sem_class>기호</sem_class>
				<lr>
				</lr>
			</sem_grp>
			<syn_grp>
				<comb_v type="narg_vpred">
					<form vcompound="no">~이 뜨다</form>
					<frame></frame>
				</comb_v>
				<comb_v type="narg_vpred">
					<form vcompound="no">~을 누르다</form>
					<frame></frame>
				</comb_v>
				<comb_v type="narg_vpred">
					<form vcompound="no">~을 선택하다</form>
					<frame></frame>
				</comb_v>
				<comb_v type="narg_vpred">
					<form vcompound="no">~을 클릭하다</form>
					<frame></frame>
				</comb_v>
				<comb_v type="narg_vpred">
					<form vcompound="no">~을 만들다</form>
					<frame></frame>
				</comb_v>
				<cl type="uni">개</cl>
				<s_n>S는 ~</s_n>
			</syn_grp>
		</sense>
		<sense n="2">
			<sem_grp>
				<eg>심슨 가족은 미키마우스처럼 세계적인 ~으로 자리잡았다.</eg>
				<trans>icon</trans>
				<sem_class>긍정적속성구체물</sem_class>
				<lr>
				</lr>
			</sem_grp>
			<syn_grp>
				<comb_n type="compound">패션 ~</comb_n>
				<comb_v type="narg_vpred">
					<form vcompound="no">~이 되다</form>
					<frame></frame>
				</comb_v>
				<comb_v type="narg_vpred">
					<form vcompound="no">~로 자리잡다</form>
					<frame></frame>
				</comb_v>
				<cl type="temp"></cl>
				<s_n>S는 ~</s_n>
			</syn_grp>
		</sense>
		<sense n="3">
			<sem_grp>
				<eg>정성 들여 금박을 입힌 ~ 속의 성모와 아기 예수는 인자한 모습이었다.</eg>
				<trans>icon</trans>
				<domain>가톨</domain>
				<sem_class>회화</sem_class>
				<lr>
					<syn type="perfect">성상화</syn>
				</lr>
			</sem_grp>
			<syn_grp>
				<cl type="uni">개</cl>
				<cl type="uni">점</cl>
				<s_n>S는 ~</s_n>
			</syn_grp>
		</sense>
	</entry>
</superEntry>