<?xml version="1.0" encoding="euc-kr" standalone="no"?>
<!DOCTYPE superEntry SYSTEM "2007nn.dtd">
<superEntry>
	<orth>영</orth>
	<entry n="1" pos="nng_s">
		<mnt_grp>
			<cre>
				<cre_date>2003/11/05</cre_date>
				<cre_writer>최지임</cre_writer>
			</cre>
			<mod>
				<mod_date>2003/11/05</mod_date>
				<mod_writer>최지임</mod_writer>
			</mod>
			<mod>
				<mod_date>2004/09/23</mod_date>
				<mod_writer>박재연</mod_writer>
				<mod_note>을 받다 추가</mod_note>
			</mod>
			<mod>
				<mod_date>2004/10/31</mod_date>
				<mod_writer>나윤희</mod_writer>
				<mod_note></mod_note>
			</mod>
			<mod>
				<mod_date>2004/12/29</mod_date>
				<mod_writer>고길수</mod_writer>
				<mod_note>의미부류 추가</mod_note>
				<mod_note>동사결합 정보 추가 및 수정</mod_note>
				<mod_note>논항명사구 정보 추가</mod_note>
				<mod_note>논항 의미정보 추가</mod_note>
				<mod_note>단위표현 정보 추가</mod_note>
				<mod_note>센스2 추가</mod_note>
			</mod>
			<mod>
				<mod_date>2007/07/29</mod_date>
				<mod_writer>호정은</mod_writer>
				<mod_note>센스 2 최대논항구조 삭제</mod_note>
				<mod_note>문형 띄어쓰기 수정</mod_note>
			</mod>
		</mnt_grp>
		<morph_grp>
			<org lg="si">令</org>
			<hom exist="yes"/>
		</morph_grp>
		<idm_grp>
		</idm_grp>
		<sense n="1">
			<sem_grp>
				<eg>그는 거북이의 간을 가져오라는 ~을 받았다.</eg>
				<trans>order</trans>
				<sem_class>명령</sem_class> <!-- 추가 -->
				<lr>
				</lr>
			</sem_grp>
			<syn_grp>
				<comb_v type="npred_vpred"> <!-- 추가함 -->
					<form vcompound="no">~을 거역하다</form>
					<frame></frame>
				</comb_v>
				<comb_v type="npred_vsupvar"> <!-- 추가함 -->
					<form vcompound="no"></form>
					<frame>X-이 Z-에게 Y-을 ~을 내리다</frame>
					<frame>X-이 Z-에게 S것-을 ~을 내리다</frame>
					<frame>X-이 Z-에게 S라고 ~을 내리다</frame>
				</comb_v>
				<comb_v type="npred_vsup">
					<form vcompound="yes">~을 받다</form>
					<frame>Z-이 X-에게서 Y-을 ~을 받다</frame> <!-- 추가 -->
					<frame>Z-이 X-에게서 S것-을 ~을 받다</frame> <!-- 추가 -->
					<frame>Z-이 X-에게서 S라고 ~을 받다</frame> <!-- S라는 수정 -->
				</comb_v>
				<max_n_str>Z-에대한 X-의 ~</max_n_str> <!-- 추가함 -->
				<sel_rst arg="X">인간</sel_rst>
				<sel_rst arg="Y">행위|계획사건</sel_rst> <!-- 추가함 -->
				<sel_rst arg="Z">인간|인간집단</sel_rst>
				<cl type="uni">번</cl> <!-- 추가함 -->
				<cl type="uni">차례</cl> <!-- 추가함 -->
				<cl type="uni">회</cl> <!-- 추가함 -->
				<s_n>S라는 ~</s_n>
			</syn_grp>
		</sense>
		<sense> <!-- 추가함 -->
			<sem_grp>
				<eg>신하들이 왕에게 ~을 개정할 것을 간언했다.</eg>
				<trans>ordinance</trans>
				<sem_class>법률</sem_class>
				<lr>
					<syn type="etc">법령</syn>
				</lr>
			</sem_grp>
			<syn_grp>
				<comb_v type="narg_vpred"> <!-- 추가함 -->
					<form vcompound="no">~을 개정하다</form>
					<frame></frame>
				</comb_v>
				<max_n_str></max_n_str>
				<sel_rst arg="X">온</sel_rst>
			</syn_grp>
		</sense>
	</entry>
	<entry n="2" pos="nng_s">
		<mnt_grp>
			<cre>
				<cre_date>2003/11/05</cre_date>
				<cre_writer>최지임</cre_writer>
			</cre>
			<mod>
				<mod_date>2003/11/05</mod_date>
				<mod_writer>최지임</mod_writer>
			</mod>
			<mod>
				<mod_date>2004/09/23</mod_date>
				<mod_writer>박재연</mod_writer>
				<mod_note>수정및보충내용없음</mod_note>
			</mod>
			<mod>
				<mod_date>2004/10/31</mod_date>
				<mod_writer>나윤희</mod_writer>
				<mod_note></mod_note>
			</mod>
			<mod>
				<mod_date>2004/12/29</mod_date>
				<mod_writer>고길수</mod_writer>
				<mod_note></mod_note>
			</mod>
			<mod>
				<mod_date>2007/07/29</mod_date>
				<mod_writer>호정은</mod_writer>
				<mod_note>수정 없음</mod_note>
			</mod>
		</mnt_grp>
		<morph_grp>
			<org lg="si">嶺</org>
			<hom exist="yes"/>
		</morph_grp>
		<idm_grp>
		</idm_grp>
		<sense n="1">
			<sem_grp>
				<eg>이 ~을 넘으면 해가 저물기 전에 마을에 도착할 수 있다.</eg>
				<trans>high hills</trans>
				<sem_class>고지대</sem_class>
				<lr>
				</lr>
			</sem_grp>
			<syn_grp>
				<comb_v type="narg_vpred">
					<form vcompound="no">~을 넘다</form>
					<frame></frame>
				</comb_v>
				<cl type="uni">개</cl>
			</syn_grp>
		</sense>
	</entry>
	<entry n="3" pos="nng_s">
		<mnt_grp>
			<cre>
				<cre_date>2003/11/05</cre_date>
				<cre_writer>최지임</cre_writer>
			</cre>
			<mod>
				<mod_date>2003/11/05</mod_date>
				<mod_writer>최지임</mod_writer>
			</mod>
			<mod>
				<mod_date>2004/09/23</mod_date>
				<mod_writer>박재연</mod_writer>
				<mod_note>수정및보충내용없음</mod_note>
			</mod>
			<mod>
				<mod_date>2004/10/31</mod_date>
				<mod_writer>나윤희</mod_writer>
				<mod_note></mod_note>
			</mod>
			<mod>
				<mod_date>2004/12/29</mod_date>
				<mod_writer>고길수</mod_writer>
				<mod_note>수사??</mod_note>
			</mod>
			<mod>
				<mod_date>2007/07/29</mod_date>
				<mod_writer>호정은</mod_writer>
				<mod_note>수사에서 기술한 표제어, 삭제 요망</mod_note>
			</mod>
		</mnt_grp>
		<morph_grp>
			<org lg="si">零</org>
			<hom exist="yes"/>
		</morph_grp>
		<idm_grp>
		</idm_grp>
		<sense n="1">
			<sem_grp>
				<eg>우리 팀의 전반전 득점은 ~이다.</eg>
				<trans>zero</trans>
				<sem_class>수량속성값</sem_class>
				<lr>
				</lr>
			</sem_grp>
			<syn_grp>
			</syn_grp>
		</sense>
	</entry>
	<entry n="4" pos="nng_s">
		<mnt_grp>
			<cre>
				<cre_date>2003/11/05</cre_date>
				<cre_writer>최지임</cre_writer>
			</cre>
			<mod>
				<mod_date>2003/11/05</mod_date>
				<mod_writer>최지임</mod_writer>
			</mod>
			<mod>
				<mod_date>2004/09/23</mod_date>
				<mod_writer>박재연</mod_writer>
				<mod_note>단위명사 명에서 위로 수정</mod_note>
			</mod>
			<mod>
				<mod_date>2004/10/31</mod_date>
				<mod_writer>나윤희</mod_writer>
				<mod_note></mod_note>
			</mod>
			<mod>
				<mod_date>2004/12/29</mod_date>
				<mod_writer>고길수</mod_writer>
				<mod_note></mod_note>
			</mod>
			<mod>
				<mod_date>2007/07/29</mod_date>
				<mod_writer>호정은</mod_writer>
				<mod_note>수정 없음</mod_note>
			</mod>
		</mnt_grp>
		<morph_grp>
			<org lg="si">靈</org>
			<hom exist="yes"/>
		</morph_grp>
		<idm_grp>
		</idm_grp>
		<sense n="1">
			<sem_grp>
				<eg>그녀는 떠돌아다니는 ~을 볼 줄 아는 능력이 있다.</eg>
				<trans>spirit</trans>
				<trans>soul</trans>
				<sem_class>상상적인간</sem_class>
				<lr>
				</lr>
			</sem_grp>
			<syn_grp>
				<cl type="uni">위</cl>
			</syn_grp>
		</sense>
	</entry>
</superEntry>