<?xml version="1.0" encoding="euc-kr" standalone="no"?>
<!DOCTYPE superEntry SYSTEM "2007nn.dtd">
<superEntry>
	<orth>비표</orth>
	<entry n="1" pos="nng_s">
		<mnt_grp>
			<cre>
				<cre_date>2003/05/29</cre_date>
				<cre_writer>김미순</cre_writer>
			</cre>
			<mod>
				<mod_date>2003/07/03</mod_date>
				<mod_writer>김진형</mod_writer>
			</mod>
			<mod>
				<mod_date>2004/10/03</mod_date>
				<mod_writer>이민우</mod_writer>
				<mod_note></mod_note>
			</mod>
			<mod>
				<mod_date>2004/12/27</mod_date>
				<mod_writer>고길수</mod_writer>
				<mod_note>동형어 추가</mod_note>
			</mod>
		</mnt_grp>
		<morph_grp>
			<org lg="si">碑表</org>
		
			<hom exist="yes"/>
		</morph_grp>
		<idm_grp>
		</idm_grp>
		<sense n="1">
			<sem_grp>
				<eg>오랜 세월을 견딘 그 비석의 ~는 알아볼 수 없을 정도로 손상되어 있었다.</eg>
				<trans>surface of tombstone</trans>
				<sem_class>구체물의부분</sem_class>
				<lr>
				</lr>
			</sem_grp>
			<syn_grp>
			<cl type="uni"></cl>
			</syn_grp>
		</sense>
	</entry>
	<entry pos="nng_s">
		<mnt_grp>
			<cre>
				<cre_date>2004/12/27</cre_date>
				<cre_writer>고길수</cre_writer>
				<cre_note></cre_note>
			</cre>
			<add></add>
		</mnt_grp>
		<see></see>
		<morph_grp>
			<org lg="si">&#31061;標</org>
		
			<hom exist="yes"/>
		</morph_grp>
		<idm_grp>
			<idm type="etc"></idm>
		</idm_grp>
		<sense>
			<sem_grp>
				<eg>그 회사는 모든 제품의 용기에 ~를 해둔다.</eg>
				<trans>secret code</trans>
				<domain></domain>
				<sem_class>구체인공물</sem_class> <!-- 검토 필요 -->
				<lr>
				</lr>
			</sem_grp>
			<syn_grp>
				<comb_v type="narg_vpred">
					<form vcompound="no">~를 표시하다</form>
					<frame></frame>
				</comb_v>
				<comb_v type="narg_vpred"> <!-- 추가함 -->
					<form vcompound="no">~를 제거하다</form>
					<frame></frame>
				</comb_v>
				<cl type="uni">개</cl>
			</syn_grp>
		</sense>
	</entry>
</superEntry>