<?xml version="1.0" encoding="euc-kr" standalone="no"?>
<!DOCTYPE superEntry SYSTEM "2007nn.dtd">
<superEntry>
	<orth>치수</orth>
	<entry n="1" pos="nng_c">
		<mnt_grp>
			<cre>
				<cre_date>2003/10/07</cre_date>
				<cre_writer>이민우</cre_writer>
			</cre>
			<mod>
				<mod_date>2003/10/21</mod_date>
				<mod_writer>김종명</mod_writer>
			</mod>
			<mod>
				<mod_date>2004/10/26</mod_date>
				<mod_writer>김미현</mod_writer>
				<mod_note>add 이동</mod_note>
				<mod_note>형용사 연쇄 추가 기술</mod_note>
			</mod>
			<mod>
				<mod_date>2004/12/22</mod_date>
				<mod_writer>김미현</mod_writer>
				<mod_note>n_n 정보 추가</mod_note>
				<mod_note>n_v 정보 중 일부 삭제</mod_note>
				<mod_note>동형어 정보 추가</mod_note>
			</mod>
                        <mod>
                                <mod_date>2007/08/16</mod_date>
                                <mod_writer>박진희</mod_writer>
                                <mod_note></mod_note>
                        </mod>
		</mnt_grp>
		<morph_grp>
			<org lg="si">_數</org>
		
		    <hom exist="yes"/> <!--추가(미현)-->
        </morph_grp>
		<idm_grp>
		</idm_grp>
		<sense n="1">
			<sem_grp>
				<eg>나는 옷을 맞추기 위해 몸의 ~를 쟀다.</eg>
				<eg>발 ~가 어떻게 됩니까?</eg>
				<trans>size</trans>
				<sem_class>길이단위</sem_class>
				<lr>
				</lr>
			</sem_grp>
			<syn_grp>
				<comb_aj type="appr">~가 크다</comb_aj>
				<comb_aj type="appr">~가 작다</comb_aj>
				<comb_n type="compound">옷 ~</comb_n>
				<comb_n type="compound">발 ~</comb_n>
				<comb_v type="narg_vpred">
					<form vcompound="no">~를 재다</form>
					<frame></frame>
				</comb_v>
			</syn_grp>
		</sense>
	</entry>
	<entry n="2" pos="nng_s">
		<mnt_grp>
			<cre>
				<cre_date>2003/10/21</cre_date>
				<cre_writer>김종명</cre_writer>
			</cre>
			<mod>
				<mod_date>2003/10/21</mod_date>
				<mod_writer>김종명</mod_writer>
			</mod>
			<mod>
				<mod_date>2004/10/26</mod_date>
				<mod_writer>김미현</mod_writer>
				<mod_note>의미부류 수정</mod_note>
			</mod>
			<mod>
				<mod_date>2004/12/22</mod_date>
				<mod_writer>김미현</mod_writer>
				<mod_note>max_n 정보 추가</mod_note>
				<mod_note>동형어 정보 추가</mod_note>
				<mod_note>합성어 정보 추가</mod_note>
			</mod>
                        <mod>
                                <mod_date>2007/08/16</mod_date>
                                <mod_writer>박진희</mod_writer>
                                <mod_note></mod_note>
                        </mod>
		</mnt_grp>
		<morph_grp>
			<org lg="si">治水</org>
		
		    <hom exist="yes"/> <!--추가(미현)-->
            <comp pos="n" type="prefix">치산~</comp> <!--추가(미현)-->
		</morph_grp>
		<idm_grp>
		</idm_grp>
		<sense n="1">
			<sem_grp>
				<eg>예로부터 치산과 ~를 잘하는 것이 중요하다.</eg>
				<trans>gouverning water</trans>
				<sem_class>지속적활동</sem_class><!--'물리적행위'에서 수정-->
				<lr>
				</lr>
			</sem_grp>
			<syn_grp>
				<comb_v type="npred_vsup">
					<form vcompound="yes">~를 하다</form>
					<frame>X-이 ~를 하다</frame>
				</comb_v>
				<max_n_str>X-의 ~</max_n_str>
				<sel_rst arg="X">인간</sel_rst>
			</syn_grp>
		</sense>
	</entry>
</superEntry>