<?xml version="1.0" encoding="euc-kr" standalone="no"?>
<!DOCTYPE superEntry SYSTEM "2007nn.dtd">
<superEntry>
	<orth>피망</orth>
	<entry n="1" pos="nng_s">
		<mnt_grp>
			<cre>
				<cre_date>2003/09/16</cre_date>
				<cre_writer>서진숙</cre_writer>
			</cre>
			<mod>
				<mod_date>2003/10/12</mod_date>
				<mod_writer>서진숙</mod_writer>
			</mod>
			<mod>
				<mod_date>2004/10/06</mod_date>
				<mod_writer>김이정</mod_writer>
				<mod_note>add를 n_v로 이동;domain(식물) 삭제</mod_note>
			</mod>
			<mod>
				<mod_date>2004/11/01</mod_date>
				<mod_writer>이광호</mod_writer>
				<mod_note></mod_note>
			</mod>
			<mod>
				<mod_date>2005/02/15</mod_date>
				<mod_writer>김미현</mod_writer>
				<mod_note>'채소'로의 센스 추가 기술</mod_note>
			</mod>
			<mod>
				<mod_date>2007/10/03</mod_date>
				<mod_writer>하신영</mod_writer>
				<mod_note></mod_note>
			</mod>
			<add>~을 따다</add>
			<add>~이 열리다</add>
		</mnt_grp>
		<morph_grp>
			<org lg="etc">piment</org>
		
		</morph_grp>
		<idm_grp>
		</idm_grp>
		<sense n="1">
			<sem_grp>
				<eg>할머니는 익은 ~부터 따서 광주리에 넣으셨다.</eg>
				<trans>piment</trans>
				<domain></domain>
				<sem_class>열매</sem_class>
				<lr>
				</lr>
			</sem_grp>
			<syn_grp>
				<comb_v type="narg_vpred">
					<form vcompound="no">~을 따다</form>
					<frame></frame>
				</comb_v>
				<comb_v type="narg_vpred">
					<form vcompound="no">~이 열리다</form>
					<frame></frame>
				</comb_v>
				<cl type="uni">개</cl>
			</syn_grp>
		</sense>
		<sense n="2">
			<sem_grp>
				<eg>샐러드에 ~을 넣으면 고소하게 먹을 수 있다.</eg>
				<trans>piment</trans>
				<domain></domain>
				<sem_class>채소</sem_class>
				<lr>
				</lr>
			</sem_grp>
			<syn_grp>
			   <cl type="uni">개</cl>
			</syn_grp>
		</sense>
	</entry>
</superEntry>