<?xml version="1.0" encoding="euc-kr" standalone="no"?>
<!DOCTYPE superEntry SYSTEM "2007nn.dtd">

<superEntry>
	<orth>서류</orth>
	<entry n="1" pos="nng_s">
		<mnt_grp>
			<cre>
				<cre_date>1999/07/26</cre_date>
				<cre_writer>정유진</cre_writer>
				<cre_note></cre_note>
			</cre>
			<mod>
				<mod_date>2003/06/17</mod_date>
				<mod_writer>고길수</mod_writer>
				<mod_note></mod_note>
			</mod>
			<mod>
				<mod_date>2006/09/16</mod_date>
				<mod_writer>이민우</mod_writer>
				<mod_note></mod_note>
			</mod>
			<mod>
				<mod_date>2007/08/10</mod_date>
				<mod_writer>고길수</mod_writer>
				<mod_note>센스1 텍스트를 문서로 수정</mod_note>
			</mod>
			<note>2000/07/04</note>
			<note>2003/04/15(이하영)sense1,2 예문수정 및 추가</note>
			<note>2003/06/17(고길수)합성어 정보 표기법 수정</note>
			<note>sense1,2의 동사자유구성 중 일부 삭제, 일부는 add항목으로 옮김</note>
			<note>sense2 단위표현 기입</note>
			<note>센스1,2에 동의어 추가</note>
			<note>센스1의 단위표현에 '통' 추가</note>
			<add>sense1 동사자유구성 '~를 작성하다|읽다|보다' 추가</add>
			<add>sense2 동사자유구성 '~를 집다|찢다|넣다|두다|넘기다|정리하다|분실하다' 추가</add>
			<add>센스1의 동사결합으로 '~를 꾸미다'</add>
		</mnt_grp>
		<see></see>
		<morph_grp>
			<var type="temp"></var>
			<str type="temp"></str>
			<org lg="si">書類</org>
			<hom exist="temp"></hom>
			<der pos="temp" type="temp"></der>
			<comp pos="n" type="suffix">~가방</comp>
			<comp pos="n" type="suffix">~꽂이</comp>
			<comp pos="n" type="suffix">~장</comp>
			<comp pos="n" type="suffix">~철</comp>
			<comp pos="n" type="suffix">~함</comp>
			<metc pos="temp" type="temp"></metc>
			<img type="temp"></img>
		</morph_grp>
		<idm_grp>
			<idm type="temp"></idm>
		</idm_grp>
		<sense n="1">
			<sem_grp>
				<eg>그는 다시 한 번 ~를 꼼꼼이 읽어보았다.</eg>
				<eg>그는 ~를 작성하느라 밤새 한숨도 잠을 자지 못했다.</eg>
				<trans>document</trans>
				<domain></domain>
				<reg></reg>
				<con></con>
				<curs type="C"/>
				<sem_class>문서</sem_class>
				<lr>
					<syn type="etc">문서</syn>
					<ant type="temp"></ant>
					<rel></rel>
				</lr>
			</sem_grp>
			<syn_grp>
				<comb_aj type="temp"></comb_aj>
				<comb_n type="compound">관계 ~</comb_n>
				<comb_n type="compound">중요 ~</comb_n>
				<comb_n type="compound">기밀 ~</comb_n>
				<comb_n type="compound">증거 ~</comb_n>
				<comb_n type="compound">신청 ~</comb_n>
				<comb_n type="compound">선적 ~</comb_n>
				<comb_n type="compound">~ 양식</comb_n>
				<comb_n type="compound">~ 전형</comb_n>
				<comb_v type="narg_vpred">
					<form vcompound="no">~를 작성하다</form>
					<frame></frame>
				</comb_v>
				<comb_v type="narg_vpred">
					<form vcompound="no">~를 보다</form>
					<frame></frame>
				</comb_v>
				<comb_v type="narg_vpred">
					<form vcompound="no">~를 읽다</form>
					<frame></frame>
				</comb_v>
				<max_n_str></max_n_str>
				<sel_rst arg="temp"></sel_rst>
				<cl type="uni">개</cl>
				<cl type="uni">장</cl>
				<cl type="uni">통</cl>
				<cl type="grp">묶음</cl>
				<cl type="grp">뭉치</cl>
				<cl type="grp">다발</cl>
				<prt></prt>
				<av></av>
				<pre_d/>
				<pre_n/>
				<s_n/>
			</syn_grp>
		</sense>
		<sense n="2">
			<sem_grp>
				<eg>급한 ~이니 빨리 부장님에게 넘기도록 해라.</eg>
				<eg>사장은 ~를 책상 위로 휙 던져버렸다.</eg>
				<trans>document</trans>
				<domain></domain>
				<reg></reg>
				<con></con>
				<curs type="C"/>
				<sem_class>텍스트담지물</sem_class>
				<lr>
					<syn type="etc">문서</syn>
					<ant type="temp"></ant>
					<rel></rel>
				</lr>
			</sem_grp>
			<syn_grp>
				<comb_aj type="appr">~가 무겁다</comb_aj>
				<comb_aj type="appr">~가 가볍다</comb_aj>
				<comb_aj type="appr">~가 두껍다</comb_aj>
				<comb_aj type="appr">~가 얇다</comb_aj>
				<comb_n type="temp"></comb_n>
				<comb_v type="narg_vpred">
					<form vcompound="no">~를 보관하다</form>
					<frame></frame>
				</comb_v>
				<comb_v type="narg_vpred">
					<form vcompound="no">~를 넣다</form>
					<frame></frame>
				</comb_v>
				<comb_v type="narg_vpred">
					<form vcompound="no">~를 두다</form>
					<frame></frame>
				</comb_v>
				<comb_v type="narg_vpred">
					<form vcompound="no">~를 정리하다</form>
					<frame></frame>
				</comb_v>
				<max_n_str></max_n_str>
				<sel_rst arg="temp"></sel_rst>
				<cl type="uni">개</cl>
				<cl type="uni">장</cl>
				<cl type="grp">묶음</cl>
				<cl type="grp">뭉치</cl>
				<cl type="grp">다발</cl>
				<prt></prt>
				<av></av>
				<pre_d/>
				<pre_n/>
				<s_n/>
			</syn_grp>
		</sense>
	</entry>
</superEntry>