<?xml version="1.0" encoding="euc-kr" standalone="no"?>
<!DOCTYPE superEntry SYSTEM "2007nn.dtd">
<superEntry>
	<orth>핑퐁</orth>
	<entry n="1" pos="nng_s">
		<mnt_grp>
			<cre>
				<cre_date>2003/09/16</cre_date>
				<cre_writer>서진숙</cre_writer>
			</cre>
			<mod>
				<mod_date>2003/10/12</mod_date>
				<mod_writer>서진숙</mod_writer>
			</mod>
			<mod>
				<mod_date>2004/10/07</mod_date>
				<mod_writer>김이정</mod_writer>
				<mod_note>센스2 추가;센스1 domain(운동) 삭제;센스1 분류사 추가;센스1 n_v 추가</mod_note>
			</mod>
			<mod>
				<mod_date>2004/11/01</mod_date>
				<mod_writer>이광호</mod_writer>
				<mod_note></mod_note>
			</mod>
			<mod>
				<mod_date>2007/10/03</mod_date>
				<mod_writer>하신영</mod_writer>
				<mod_note></mod_note>
			</mod>
		</mnt_grp>
		<morph_grp>
			<org lg="en">ping pong</org>
		
		</morph_grp>
		<idm_grp>
		</idm_grp>
		<sense n="1">
			<sem_grp>
				<eg>중국은 ~에서 타의 추종을 불허하고 있다.</eg>
				<trans>ping pong</trans>
				<domain></domain>
				<sem_class>지속적활동</sem_class>
				<lr>
					<syn type="etc">탁구</syn>
				</lr>
			</sem_grp>
			<syn_grp>
				<comb_v type="npred_vsup">
					<form vcompound="yes">~을 하다</form>
					<frame>X-이 ~을 하다</frame>
				</comb_v>
				<comb_v type="npred_vsupvar">
					<form vcompound="no">~을 치다</form>
					<frame>X-이 ~을 치다</frame>
				</comb_v>
				<sel_rst arg="X">인간</sel_rst>
				<cl type="uni">회</cl>
				<cl type="uni">번</cl>
				<cl type="uni">차례</cl>
			</syn_grp>
		</sense>
		<sense n="2">
			<sem_grp>
				<eg>이제 학교와 가정은 거대한 벽을 두고 서로 책임을 떠넘기는 ~ 게임만 하고 있다.</eg>
				<eg>원가 공개를 놓고 당과 정부가 ~을 거듭한지가 오래되었다.</eg>
				<trans>ping pong</trans>
				<domain></domain>
				<sem_class>대칭적행위</sem_class>
				<lr>
				</lr>
			</sem_grp>
			<syn_grp>
				<comb_n type="compound">~ 외교</comb_n>
				<comb_n type="compound">~ 지원</comb_n>
				<comb_v type="npred_vsup">
					<form vcompound="yes">~을 하다</form>
					<frame>X-이 Y-와 ~을 하다</frame>
					<frame>X-와 Y-이 ~을 하다</frame>
				</comb_v>
				<comb_v type="npred_vpred">
					<form vcompound="no">~을 주고받다</form>
					<frame></frame>
				</comb_v>
				<comb_v type="npred_vpred">
					<form vcompound="no">~을 거듭하다</form>
					<frame></frame>
				</comb_v>
				<sel_rst arg="X">인간|인간집단</sel_rst>
				<sel_rst arg="Y">인간|인간집단</sel_rst>
			</syn_grp>
		</sense>
	</entry>
</superEntry>