<?xml version="1.0" encoding="euc-kr" standalone="no"?>
<!DOCTYPE superEntry SYSTEM "2007nn.dtd">
<superEntry>
	<orth>여닫이</orth>
	<entry n="1" pos="nng_c">
		<mnt_grp>
			<cre>
				<cre_date>2003/11/05</cre_date>
				<cre_writer>최지임</cre_writer>
			</cre>
			<mod>
				<mod_date>2003/11/05</mod_date>
				<mod_writer>최지임</mod_writer>
			</mod>
			<mod>
				<mod_date>2004/09/23</mod_date>
				<mod_writer>박재연</mod_writer>
				<mod_note>수정및보충내용없음</mod_note>
			</mod>
			<mod>
				<mod_date>2004/10/31</mod_date>
				<mod_writer>나윤희</mod_writer>
				<mod_note></mod_note>
			</mod>
			<mod>
				<mod_date>2004/12/28</mod_date>
				<mod_writer>고길수</mod_writer>
				<mod_note>복합명사로 수정 후, 내적 구성 정보 추가</mod_note>
				<mod_note>센스1의 의미부류 수정</mod_note>
			</mod>
			<mod>
				<mod_date>2007/09/04</mod_date>
				<mod_writer>권오희</mod_writer>
				<mod_note></mod_note>
			</mod>
			<add>sense2=~를 달다</add>
			<add>sense2=~가 삐걱거리다</add>
		</mnt_grp>
		<morph_grp>
			<str type="V_S">여닫+이</str> <!-- 추가함 -->
		
		</morph_grp>
		<idm_grp>
		</idm_grp>
		<sense n="1">
			<sem_grp>
				<eg>이 문은 손님들이 다니기 편하도록 ~로 되어 있다.</eg>
				<trans>opening and shutting</trans>
				<sem_class>방식속성값</sem_class> <!-- 방식 수정 -->
				<lr>
				</lr>
			</sem_grp>
			<syn_grp>
			</syn_grp>
		</sense>
		<sense n="2">
			<sem_grp>
				<eg>바람이 불자 ~가 삐걱거리기 시작한다.</eg>
				<trans>sliding doors and windows</trans>
				<sem_class>구체물의부분</sem_class>
				<lr>
				</lr>
			</sem_grp>
			<syn_grp>
				<comb_aj type="appr">~가 낡다</comb_aj>
				<cl type="uni">개</cl>
			</syn_grp>
		</sense>
	</entry>
</superEntry>