<?xml version="1.0" encoding="euc-kr" standalone="no"?>
<!DOCTYPE superEntry SYSTEM "2007nn.dtd">

<superEntry>
	<orth>습기</orth>
	<entry n="1" pos="nng_s">
		<mnt_grp>
			<cre>
				<cre_date>2000/06/26</cre_date>
				<cre_writer>김종명</cre_writer>
				<cre_note></cre_note>
			</cre>
			<mod>
				<mod_date>2003/08/08</mod_date>
				<mod_writer>한선혜</mod_writer>
				<mod_note></mod_note>
			</mod>
			<mod>
				<mod_date>2006/08/09</mod_date>
				<mod_writer>김천학</mod_writer>
				<mod_note>의미부류수정, add 옮김</mod_note>
			</mod>
			<mod>
				<mod_date>2006/09/15</mod_date>
				<mod_writer>호정은</mod_writer>
				<mod_note>복합어, 동사결합 전반적으로 수정</mod_note>
			</mod>
			<mod>
				<mod_date>2007/09/17</mod_date>
				<mod_writer>김미현</mod_writer>
				<mod_note></mod_note>
			</mod>
			<note>2001/02/02(최지임)파생어 정보 입력</note>
			<note>2003/07/10(최지임)예문일부수정</note>
			<note>2003/08/08(한선혜)</note>
			<note>관련어 정보 입력</note>
			<note>동사 자유구성 정보 수정</note>
			<note>동사연어구성정보 add에 입력</note>
			<note>동의어 정보 입력</note>
			<note>의미부류검토요망</note>
			<note>의미부류수정</note>
			<note>합성어 정보 입력</note>
			<note>형용사 자유 구성 정보 입력</note>
			<note>형용사자유구성정보 동사연어구성정보에 입력</note>
		</mnt_grp>
		<see></see>
		<morph_grp>
			<var type="temp"></var>
			<str type="temp"></str>
			<org lg="si">濕氣</org>
		
			<hom exist="temp"></hom>
			<der pos="n" type="temp"></der>
			<comp pos="n" type="suffix">~계</comp>
			<comp pos="n" type="suffix">~인자</comp>
			<comp pos="n" type="suffix">~역전</comp>
			<metc pos="temp" type="temp"></metc>
			<img type="temp"></img>
		</morph_grp>
		<idm_grp>
			<idm type="temp"></idm>
		</idm_grp>
		<sense n="1">
			<sem_grp>
				<eg>지하실 방에 ~가 차서 벽이 눅눅하다.</eg>
				<trans>moisture</trans>
				<domain></domain>
				<reg></reg>
				<con></con>
				<curs type="U"/>
				<sem_class>기운</sem_class><!--2006/08/09김천학 '무생물'에서 '기운'으로 수정-->
				<lr>
					<syn type="etc">누기</syn>
					<ant type="temp"></ant>
					<rel>건조</rel>
				</lr>
			</sem_grp>
			<syn_grp>
				<comb_aj type="appr">~가 많다</comb_aj>
				<comb_n type="temp"></comb_n>
				<comb_v type="npred_vsupvar">
					<form vcompound="no">~가 차다</form>
					<frame>X-에 ~가 차다</frame>
					<frame>X-이 ~가 차다</frame>
				</comb_v>
				<comb_v type="npred_vpred">
					<form vcompound="no">~가 배다</form>
					<frame></frame>
				</comb_v>
				<comb_v type="npred_vpred">
					<form vcompound="no">~를 제거하다</form>
					<frame></frame>
				</comb_v>
				<max_n_str>X-의 ~</max_n_str>
				<sel_rst arg="X">구체물</sel_rst>
				<cl type="temp"></cl>
				<prt></prt>
				<av></av>
				<pre_d/>
				<pre_n/>
				<s_n/>
			</syn_grp>
		</sense>
	</entry>
</superEntry>